{
  "accepted_at": null,
  "id": "pg-019fd7b6-23c1-7ddf-8725-7a05dcf0e754-sweep",
  "measured_at": "2026-08-06T15:34:25.984Z",
  "metrics": {
    "base_memory_bytes": "27067203584",
    "base_memory_context_tokens": 192,
    "concurrency": 1,
    "decode32k_context_tokens": 32832,
    "decode32k_tps": 79.30479434655948,
    "decode8k_context_tokens": 8256,
    "decode8k_tps": 94.62640313213393,
    "decode_max_context_tokens": 262080,
    "decode_max_context_tps": 31.42817997936544,
    "decode_mode": "non-mtp",
    "inference_engine_version": "unknown",
    "latest_point_at": "2026-08-06T15:34:25.984Z",
    "max_context_tokens": 262080,
    "max_prompt_tokens": 262016,
    "memory8k_bytes": "27579990016",
    "memory8k_context_tokens": 8256,
    "memory_max_context_bytes": "30464360448",
    "memory_max_context_tokens": 262080,
    "peak_generation_tps": 79.30479434655948,
    "peak_memory_bytes": "30464360448",
    "peak_prompt_tps": 1319.6981689348845,
    "point_count": 224,
    "ttft32k_cached_prompt_tokens": 28668,
    "ttft32k_context_tokens": 32768,
    "ttft32k_seconds": 24.829920031219512
  },
  "recipe_id": "pg-unsloth-qwen3-6-35b-a3b-gguf-qwen3-6-35b-a3b-mxfp4-moe-gguf-unknown-apple-m5-max-128gb-llama-cpp-128fe1d830",
  "rows": [
    {
      "concurrency": 1,
      "context_tokens": 8256,
      "decode_tok_s": 94.62640313213393,
      "decode_tok_s_per_stream": 94.62640313213393,
      "output_tokens": null,
      "peak_vram_gb": 25.685867309570312,
      "prefill_tok_s": null,
      "samples": 1,
      "status": "observed",
      "ttft_ms_p50": null
    },
    {
      "concurrency": 1,
      "context_tokens": 32832,
      "decode_tok_s": 79.30479434655948,
      "decode_tok_s_per_stream": 79.30479434655948,
      "output_tokens": null,
      "peak_vram_gb": 28.372146606445312,
      "prefill_tok_s": null,
      "samples": 1,
      "status": "observed",
      "ttft_ms_p50": null
    },
    {
      "concurrency": 1,
      "context_tokens": 262080,
      "decode_tok_s": 31.42817997936544,
      "decode_tok_s_per_stream": 31.42817997936544,
      "output_tokens": null,
      "peak_vram_gb": 28.372146606445312,
      "prefill_tok_s": null,
      "samples": 1,
      "status": "observed",
      "ttft_ms_p50": null
    },
    {
      "concurrency": 1,
      "context_tokens": 32768,
      "decode_tok_s": null,
      "decode_tok_s_per_stream": null,
      "output_tokens": null,
      "peak_vram_gb": null,
      "prefill_tok_s": null,
      "samples": 1,
      "status": "observed",
      "ttft_ms_p50": 24829.920031219513
    }
  ],
  "schema_version": "local-ai-registry/v1",
  "source": {
    "commit": null,
    "paths": [
      "publication:pg-20260827T060320709Z",
      "run:019fd7b6-23c1-7ddf-8725-7a05dcf0e754"
    ],
    "repository": "https://local.ai"
  }
}
