{
  "accepted_at": null,
  "id": "pg-019f8af2-ae78-705b-aae7-e2d22d9dd53f-sweep",
  "measured_at": "2026-07-22T17:49:47.801Z",
  "metrics": {
    "base_memory_bytes": "26513408000",
    "base_memory_context_tokens": 192,
    "concurrency": 1,
    "decode32k_context_tokens": 32832,
    "decode32k_tps": 42.85479923530968,
    "decode8k_context_tokens": 8256,
    "decode8k_tps": 53.62658135571349,
    "decode_max_context_tokens": 262080,
    "decode_max_context_tps": 7.482964563485939,
    "decode_mode": "non-mtp",
    "inference_engine_version": "unknown",
    "latest_point_at": "2026-07-22T17:49:47.801Z",
    "max_context_tokens": 262080,
    "max_prompt_tokens": 262016,
    "memory8k_bytes": "27026243584",
    "memory8k_context_tokens": 8256,
    "memory_max_context_bytes": "29909467136",
    "memory_max_context_tokens": 262080,
    "peak_generation_tps": 42.85479923530968,
    "peak_memory_bytes": "29909467136",
    "peak_prompt_tps": 397.8855391994407,
    "point_count": 224,
    "ttft32k_cached_prompt_tokens": 28668,
    "ttft32k_context_tokens": 32768,
    "ttft32k_seconds": 82.35534286048781
  },
  "recipe_id": "pg-internscience-agents-a1-q4-k-m-gguf-agents-a1-q4-k-m-gguf-q4km-apple-m4-pro-48gb-llama-cpp-180f7801bc",
  "rows": [
    {
      "concurrency": 1,
      "context_tokens": 8256,
      "decode_tok_s": 53.62658135571349,
      "decode_tok_s_per_stream": 53.62658135571349,
      "output_tokens": null,
      "peak_vram_gb": 25.170150756835938,
      "prefill_tok_s": null,
      "samples": 1,
      "status": "observed",
      "ttft_ms_p50": null
    },
    {
      "concurrency": 1,
      "context_tokens": 32832,
      "decode_tok_s": 42.85479923530968,
      "decode_tok_s_per_stream": 42.85479923530968,
      "output_tokens": null,
      "peak_vram_gb": 27.855361938476562,
      "prefill_tok_s": null,
      "samples": 1,
      "status": "observed",
      "ttft_ms_p50": null
    },
    {
      "concurrency": 1,
      "context_tokens": 262080,
      "decode_tok_s": 7.482964563485939,
      "decode_tok_s_per_stream": 7.482964563485939,
      "output_tokens": null,
      "peak_vram_gb": 27.855361938476562,
      "prefill_tok_s": null,
      "samples": 1,
      "status": "observed",
      "ttft_ms_p50": null
    },
    {
      "concurrency": 1,
      "context_tokens": 32768,
      "decode_tok_s": null,
      "decode_tok_s_per_stream": null,
      "output_tokens": null,
      "peak_vram_gb": null,
      "prefill_tok_s": null,
      "samples": 1,
      "status": "observed",
      "ttft_ms_p50": 82355.34286048781
    }
  ],
  "schema_version": "local-ai-registry/v1",
  "source": {
    "commit": null,
    "paths": [
      "publication:pg-20260827T060320709Z",
      "run:019f8af2-ae78-705b-aae7-e2d22d9dd53f"
    ],
    "repository": "https://local.ai"
  }
}
