{
  "accepted_at": null,
  "id": "qwen3-coder-30b-a3b-instruct-q4-k-m-rx-7900-xtx-24gb-llama-cpp-tp1-g4ytl79y-sweep",
  "measured_at": "2026-07-15T02:03:27.906Z",
  "metrics": {
    "concurrency": 1,
    "latest_point_at": "2026-07-15T02:03:27.906Z",
    "max_context_tokens": 2048,
    "peak_generation_tps": 43.8,
    "peak_prompt_tps": 230,
    "point_count": 1
  },
  "recipe_id": "qwen3-coder-30b-a3b-instruct-q4-k-m-rx-7900-xtx-24gb-llama-cpp-tp1-g4ytl79y",
  "rows": [
    {
      "concurrency": 1,
      "context_tokens": 2048,
      "decode_tok_s": 43.8,
      "decode_tok_s_per_stream": null,
      "output_tokens": 512,
      "peak_vram_gb": 24.15,
      "prefill_tok_s": 230,
      "samples": 1,
      "status": "observed",
      "ttft_ms_p50": 2116
    }
  ],
  "schema_version": "local-ai-registry/v1",
  "source": {
    "commit": null,
    "kind": "leaderboard",
    "paths": [
      "/en/runs/cmrlfrnz60bw6mj01g4ytl79y"
    ],
    "repository": "https://www.localmaxxing.com",
    "url": "https://www.localmaxxing.com/en/runs/cmrlfrnz60bw6mj01g4ytl79y"
  }
}
