{
  "accepted_at": null,
  "id": "qwen3-5-0-8b-base-mq4-rx-9070-xt-16gb-hipfire-tp1-sweep",
  "measured_at": "2026-08-10T20:39:34.011Z",
  "metrics": {
    "concurrency": 1,
    "latest_point_at": "2026-08-10T20:39:34.011Z",
    "max_context_tokens": 128,
    "peak_generation_tps": 545.272,
    "peak_prompt_tps": null,
    "point_count": 1
  },
  "recipe_id": "qwen3-5-0-8b-base-mq4-rx-9070-xt-16gb-hipfire-tp1",
  "rows": [
    {
      "concurrency": 1,
      "context_tokens": 128,
      "decode_tok_s": 545.272,
      "decode_tok_s_per_stream": null,
      "output_tokens": 100,
      "peak_vram_gb": null,
      "prefill_tok_s": null,
      "samples": 1,
      "status": "observed",
      "ttft_ms_p50": 67
    }
  ],
  "schema_version": "local-ai-registry/v1",
  "source": {
    "commit": null,
    "kind": "leaderboard",
    "paths": [
      "/en/runs/cmsnp34or00nco001vjgo5dg0"
    ],
    "repository": "https://www.localmaxxing.com",
    "url": "https://www.localmaxxing.com/en/runs/cmsnp34or00nco001vjgo5dg0"
  }
}
