{
  "accepted_at": null,
  "id": "pg-01a02ebd-fef2-7f4c-9bd1-53a9d8f2fdb9-sweep",
  "measured_at": "2026-08-23T13:09:58.630Z",
  "metrics": {
    "base_memory_bytes": "23307288576",
    "base_memory_context_tokens": 192,
    "concurrency": 1,
    "decode32k_context_tokens": 32832,
    "decode32k_tps": 18.797942095289116,
    "decode8k_context_tokens": 8256,
    "decode8k_tps": 26.147507897364495,
    "decode_max_context_tokens": 262080,
    "decode_max_context_tps": 2.841940126804704,
    "decode_mode": "non-mtp",
    "inference_engine_version": "9591 (62061f910)",
    "latest_point_at": "2026-08-23T13:09:58.630Z",
    "max_context_tokens": 262080,
    "max_prompt_tokens": 262016,
    "memory8k_bytes": "24598642688",
    "memory8k_context_tokens": 8256,
    "memory_max_context_bytes": "28964012032",
    "memory_max_context_tokens": 262080,
    "peak_generation_tps": 18.797942095289116,
    "peak_memory_bytes": "28964012032",
    "peak_prompt_tps": 95.81200581452684,
    "point_count": 224,
    "ttft32k_cached_prompt_tokens": 28668,
    "ttft32k_context_tokens": 32768,
    "ttft32k_seconds": 342.0030686282927
  },
  "recipe_id": "pg-bonsai-27b-q1-0-dspark-q4-1-q1-0-apple-m4-pro-48gb-llama-cpp-a7e8287455",
  "rows": [
    {
      "concurrency": 1,
      "context_tokens": 8256,
      "decode_tok_s": 26.147507897364495,
      "decode_tok_s_per_stream": 26.147507897364495,
      "output_tokens": null,
      "peak_vram_gb": 22.909271240234375,
      "prefill_tok_s": null,
      "samples": 1,
      "status": "observed",
      "ttft_ms_p50": null
    },
    {
      "concurrency": 1,
      "context_tokens": 32832,
      "decode_tok_s": 18.797942095289116,
      "decode_tok_s_per_stream": 18.797942095289116,
      "output_tokens": null,
      "peak_vram_gb": 26.974838256835938,
      "prefill_tok_s": null,
      "samples": 1,
      "status": "observed",
      "ttft_ms_p50": null
    },
    {
      "concurrency": 1,
      "context_tokens": 262080,
      "decode_tok_s": 2.841940126804704,
      "decode_tok_s_per_stream": 2.841940126804704,
      "output_tokens": null,
      "peak_vram_gb": 26.974838256835938,
      "prefill_tok_s": null,
      "samples": 1,
      "status": "observed",
      "ttft_ms_p50": null
    },
    {
      "concurrency": 1,
      "context_tokens": 32768,
      "decode_tok_s": null,
      "decode_tok_s_per_stream": null,
      "output_tokens": null,
      "peak_vram_gb": null,
      "prefill_tok_s": null,
      "samples": 1,
      "status": "observed",
      "ttft_ms_p50": 342003.0686282927
    }
  ],
  "schema_version": "local-ai-registry/v1",
  "source": {
    "commit": null,
    "paths": [
      "publication:pg-20260827T060320709Z",
      "run:01a02ebd-fef2-7f4c-9bd1-53a9d8f2fdb9"
    ],
    "repository": "https://local.ai"
  }
}
