{
  "accepted_at": null,
  "id": "pg-019f2c34-e1f1-7fca-9941-c07b3920b5a8-sweep",
  "measured_at": "2026-07-04T08:18:11.054Z",
  "metrics": {
    "base_memory_bytes": "33155977196",
    "base_memory_context_tokens": 192,
    "concurrency": 1,
    "decode32k_context_tokens": 32832,
    "decode32k_tps": 12.5724,
    "decode8k_context_tokens": 8256,
    "decode8k_tps": 14.468,
    "decode_max_context_tokens": 258111,
    "decode_max_context_tps": 5.8028,
    "decode_mode": "non-mtp",
    "inference_engine_version": "0.31.3",
    "latest_point_at": "2026-07-04T08:18:11.054Z",
    "max_context_tokens": 258111,
    "max_prompt_tokens": 258047,
    "memory8k_bytes": "38669495542",
    "memory8k_context_tokens": 8256,
    "memory_max_context_bytes": "112389614838",
    "memory_max_context_tokens": 258111,
    "peak_generation_tps": 12.5724,
    "peak_memory_bytes": "112389614838",
    "peak_prompt_tps": 471.9731,
    "point_count": 223,
    "ttft32k_cached_prompt_tokens": 28736,
    "ttft32k_context_tokens": 32768,
    "ttft32k_seconds": 69.42768560326849
  },
  "recipe_id": "pg-mlx-community-gemma-4-31b-it-8bit-8bit-apple-m5-max-128gb-mlx-29a9fd60a2",
  "rows": [
    {
      "concurrency": 1,
      "context_tokens": 8256,
      "decode_tok_s": 14.468,
      "decode_tok_s_per_stream": 14.468,
      "output_tokens": null,
      "peak_vram_gb": 36.01377414725721,
      "prefill_tok_s": null,
      "samples": 1,
      "status": "observed",
      "ttft_ms_p50": null
    },
    {
      "concurrency": 1,
      "context_tokens": 32832,
      "decode_tok_s": 12.5724,
      "decode_tok_s_per_stream": 12.5724,
      "output_tokens": null,
      "peak_vram_gb": 104.67098545096815,
      "prefill_tok_s": null,
      "samples": 1,
      "status": "observed",
      "ttft_ms_p50": null
    },
    {
      "concurrency": 1,
      "context_tokens": 258111,
      "decode_tok_s": 5.8028,
      "decode_tok_s_per_stream": 5.8028,
      "output_tokens": null,
      "peak_vram_gb": 104.67098545096815,
      "prefill_tok_s": null,
      "samples": 1,
      "status": "observed",
      "ttft_ms_p50": null
    },
    {
      "concurrency": 1,
      "context_tokens": 32768,
      "decode_tok_s": null,
      "decode_tok_s_per_stream": null,
      "output_tokens": null,
      "peak_vram_gb": null,
      "prefill_tok_s": null,
      "samples": 1,
      "status": "observed",
      "ttft_ms_p50": 69427.68560326849
    }
  ],
  "schema_version": "local-ai-registry/v1",
  "source": {
    "commit": null,
    "paths": [
      "publication:pg-20260827T060320709Z",
      "run:019f2c34-e1f1-7fca-9941-c07b3920b5a8"
    ],
    "repository": "https://local.ai"
  }
}
