{
  "accepted_at": null,
  "id": "hy-mt2-7b-q4-k-m-rtx-3090-24gb-llama-cpp-tp1-sweep",
  "measured_at": "2026-07-20T06:30:59.658Z",
  "metrics": {
    "concurrency": 1,
    "latest_point_at": "2026-07-20T06:30:59.658Z",
    "max_context_tokens": 1024,
    "peak_generation_tps": 98.1,
    "peak_prompt_tps": 4061.86,
    "point_count": 1
  },
  "recipe_id": "hy-mt2-7b-q4-k-m-rtx-3090-24gb-llama-cpp-tp1",
  "rows": [
    {
      "concurrency": 1,
      "context_tokens": 1024,
      "decode_tok_s": 98.1,
      "decode_tok_s_per_stream": 98.1,
      "output_tokens": 128,
      "peak_vram_gb": null,
      "prefill_tok_s": 4061.86,
      "samples": 1,
      "status": "observed",
      "ttft_ms_p50": null
    }
  ],
  "schema_version": "local-ai-registry/v1",
  "source": {
    "commit": null,
    "kind": "leaderboard",
    "paths": [
      "/en/runs/cmrsuiyx506zzlg01o2na9g30"
    ],
    "repository": "https://www.localmaxxing.com",
    "url": "https://www.localmaxxing.com/en/runs/cmrsuiyx506zzlg01o2na9g30"
  }
}
