{
  "accepted_at": null,
  "id": "pg-019f90a9-fa06-72d3-95e6-f9158254d492-sweep",
  "measured_at": "2026-07-23T20:28:06.530Z",
  "metrics": {
    "base_memory_bytes": "76554304",
    "base_memory_context_tokens": 192,
    "concurrency": 1,
    "decode32k_context_tokens": 32832,
    "decode32k_tps": 36.03345931906897,
    "decode8k_context_tokens": 8256,
    "decode8k_tps": 37.71258999461417,
    "decode_max_context_tokens": 262080,
    "decode_max_context_tps": 24.64384826012506,
    "decode_mode": "non-mtp",
    "inference_engine_version": "unknown",
    "latest_point_at": "2026-07-23T20:28:06.530Z",
    "max_context_tokens": 262080,
    "max_prompt_tokens": 262016,
    "memory8k_bytes": "142614592",
    "memory8k_context_tokens": 8256,
    "memory_max_context_bytes": "2221940800",
    "memory_max_context_tokens": 262080,
    "peak_generation_tps": 36.03345931906897,
    "peak_memory_bytes": "2221940800",
    "peak_prompt_tps": 678.4123562386304,
    "point_count": 224,
    "ttft32k_cached_prompt_tokens": 28668,
    "ttft32k_context_tokens": 32768,
    "ttft32k_seconds": 48.30100704780487
  },
  "recipe_id": "pg-unsloth-nvidia-nemotron-3-super-120b-a12b-gguf-ud-q3-k-m-nv-a8bc4e5fe708-apple-m5-max-128gb-llama-cpp-b65388164d",
  "rows": [
    {
      "concurrency": 1,
      "context_tokens": 8256,
      "decode_tok_s": 37.71258999461417,
      "decode_tok_s_per_stream": 37.71258999461417,
      "output_tokens": null,
      "peak_vram_gb": 0.13282018899917603,
      "prefill_tok_s": null,
      "samples": 1,
      "status": "observed",
      "ttft_ms_p50": null
    },
    {
      "concurrency": 1,
      "context_tokens": 32832,
      "decode_tok_s": 36.03345931906897,
      "decode_tok_s_per_stream": 36.03345931906897,
      "output_tokens": null,
      "peak_vram_gb": 2.069343626499176,
      "prefill_tok_s": null,
      "samples": 1,
      "status": "observed",
      "ttft_ms_p50": null
    },
    {
      "concurrency": 1,
      "context_tokens": 262080,
      "decode_tok_s": 24.64384826012506,
      "decode_tok_s_per_stream": 24.64384826012506,
      "output_tokens": null,
      "peak_vram_gb": 2.069343626499176,
      "prefill_tok_s": null,
      "samples": 1,
      "status": "observed",
      "ttft_ms_p50": null
    },
    {
      "concurrency": 1,
      "context_tokens": 32768,
      "decode_tok_s": null,
      "decode_tok_s_per_stream": null,
      "output_tokens": null,
      "peak_vram_gb": null,
      "prefill_tok_s": null,
      "samples": 1,
      "status": "observed",
      "ttft_ms_p50": 48301.00704780487
    }
  ],
  "schema_version": "local-ai-registry/v1",
  "source": {
    "commit": null,
    "paths": [
      "publication:pg-20260827T060320709Z",
      "run:019f90a9-fa06-72d3-95e6-f9158254d492"
    ],
    "repository": "https://local.ai"
  }
}
