{
  "accepted_at": "2026-09-06T22:52:55Z",
  "id": "gemma-4-26b-a4b-it-q4-k-xl-radeon-pro-w7800-48gb-llama-cpp-mtp-tp1-acceptance",
  "measured_at": "2026-09-06T22:52:55Z",
  "metrics": {
    "concurrency": 1,
    "latest_point_at": "2026-09-06T22:52:55Z",
    "max_context_tokens": 8192,
    "peak_generation_tps": 112.9,
    "peak_prompt_tps": null,
    "point_count": 3
  },
  "recipe_id": "gemma-4-26b-a4b-it-q4-k-xl-radeon-pro-w7800-48gb-llama-cpp-mtp-tp1",
  "rows": [
    {
      "concurrency": 1,
      "context_tokens": 8192,
      "decode_tok_s": 112.9,
      "decode_tok_s_per_stream": 112.9,
      "output_tokens": 1470,
      "peak_vram_gb": null,
      "prefill_tok_s": null,
      "samples": 3,
      "status": "accepted",
      "ttft_ms_p50": 435.6
    }
  ],
  "schema_version": "local-ai-registry/v1",
  "source": {
    "commit": null,
    "kind": "acceptance-run",
    "paths": null,
    "repository": null,
    "url": "https://github.com/0xSero/local-ai-registry"
  }
}
