{
  "accepted_at": null,
  "id": "pg-01a026ab-53c9-713d-95ec-953516068c5d-sweep",
  "measured_at": "2026-08-21T23:32:37.427Z",
  "metrics": {
    "base_memory_bytes": "3223423104",
    "base_memory_context_tokens": 192,
    "concurrency": 1,
    "decode32k_context_tokens": 32832,
    "decode32k_tps": 105.99887376196628,
    "decode8k_context_tokens": 8256,
    "decode8k_tps": 119.91014233708616,
    "decode_max_context_tokens": 131008,
    "decode_max_context_tps": 70.45090782599506,
    "decode_mode": "non-mtp",
    "inference_engine_version": "unknown",
    "latest_point_at": "2026-08-21T23:32:37.427Z",
    "max_context_tokens": 131008,
    "max_prompt_tokens": 130944,
    "memory8k_bytes": "3801450624",
    "memory8k_context_tokens": 8256,
    "memory_max_context_bytes": "12600313984",
    "memory_max_context_tokens": 131008,
    "peak_generation_tps": 96.74337610196753,
    "peak_memory_bytes": "12600313984",
    "peak_prompt_tps": 1282.1463931963603,
    "point_count": 112,
    "ttft32k_cached_prompt_tokens": 28677,
    "ttft32k_context_tokens": 32768,
    "ttft32k_seconds": 19.7228277174285
  },
  "recipe_id": "pg-unsloth-gemma-4-e2b-it-gguf-gemma-4-e2b-it-ud-q4-k-xl-gguf-ud-q4-k-xl-apple-m3-ultra-96gb-60c-llama-cpp-49232a8fbb",
  "rows": [
    {
      "concurrency": 1,
      "context_tokens": 8256,
      "decode_tok_s": 119.91014233708616,
      "decode_tok_s_per_stream": 119.91014233708616,
      "output_tokens": null,
      "peak_vram_gb": 3.5403767824172974,
      "prefill_tok_s": null,
      "samples": 1,
      "status": "observed",
      "ttft_ms_p50": null
    },
    {
      "concurrency": 1,
      "context_tokens": 32832,
      "decode_tok_s": 105.99887376196628,
      "decode_tok_s_per_stream": 105.99887376196628,
      "output_tokens": null,
      "peak_vram_gb": 11.734956860542297,
      "prefill_tok_s": null,
      "samples": 1,
      "status": "observed",
      "ttft_ms_p50": null
    },
    {
      "concurrency": 1,
      "context_tokens": 131008,
      "decode_tok_s": 70.45090782599506,
      "decode_tok_s_per_stream": 70.45090782599506,
      "output_tokens": null,
      "peak_vram_gb": 11.734956860542297,
      "prefill_tok_s": null,
      "samples": 1,
      "status": "observed",
      "ttft_ms_p50": null
    },
    {
      "concurrency": 1,
      "context_tokens": 32768,
      "decode_tok_s": null,
      "decode_tok_s_per_stream": null,
      "output_tokens": null,
      "peak_vram_gb": null,
      "prefill_tok_s": null,
      "samples": 1,
      "status": "observed",
      "ttft_ms_p50": 19722.8277174285
    }
  ],
  "schema_version": "local-ai-registry/v1",
  "source": {
    "commit": null,
    "paths": [
      "publication:pg-20260827T060320709Z",
      "run:01a026ab-53c9-713d-95ec-953516068c5d"
    ],
    "repository": "https://local.ai"
  }
}
