{
  "accepted_at": null,
  "id": "grug-12b-q4-k-m-rx-7700-xt-12gb-vllm-tp1-sweep",
  "measured_at": "2026-07-14T03:44:55.592Z",
  "metrics": {
    "concurrency": 1,
    "latest_point_at": "2026-07-14T03:44:55.592Z",
    "max_context_tokens": 2048,
    "peak_generation_tps": 15.5,
    "peak_prompt_tps": 81.8,
    "point_count": 1
  },
  "recipe_id": "grug-12b-q4-k-m-rx-7700-xt-12gb-vllm-tp1",
  "rows": [
    {
      "concurrency": 1,
      "context_tokens": 2048,
      "decode_tok_s": 15.5,
      "decode_tok_s_per_stream": null,
      "output_tokens": 256,
      "peak_vram_gb": null,
      "prefill_tok_s": 81.8,
      "samples": 1,
      "status": "observed",
      "ttft_ms_p50": 598.7
    }
  ],
  "schema_version": "local-ai-registry/v1",
  "source": {
    "commit": null,
    "kind": "leaderboard",
    "paths": [
      "/en/runs/cmrk3yalk0304mj01lnq39bh4"
    ],
    "repository": "https://www.localmaxxing.com",
    "url": "https://www.localmaxxing.com/en/runs/cmrk3yalk0304mj01lnq39bh4"
  }
}
