{
  "accepted_at": null,
  "id": "pg-019f8a23-1d69-7248-bdcf-121a0a452026-sweep",
  "measured_at": "2026-07-22T14:03:04.930Z",
  "metrics": {
    "base_memory_bytes": "18906152960",
    "base_memory_context_tokens": 192,
    "concurrency": 1,
    "decode32k_context_tokens": 32832,
    "decode32k_tps": 78.57041136521,
    "decode8k_context_tokens": 8256,
    "decode8k_tps": 87.14359630729011,
    "decode_max_context_tokens": 262080,
    "decode_max_context_tps": 37.69735152544689,
    "decode_mode": "non-mtp",
    "inference_engine_version": "unknown",
    "latest_point_at": "2026-07-22T14:03:04.930Z",
    "max_context_tokens": 262080,
    "max_prompt_tokens": 262016,
    "memory8k_bytes": "19419037696",
    "memory8k_context_tokens": 8256,
    "memory_max_context_bytes": "22346383360",
    "memory_max_context_tokens": 262080,
    "peak_generation_tps": 78.57041136521,
    "peak_memory_bytes": "22346383360",
    "peak_prompt_tps": 1404.9578564043975,
    "point_count": 224,
    "ttft32k_cached_prompt_tokens": 28668,
    "ttft32k_context_tokens": 32768,
    "ttft32k_seconds": 23.323119516097563
  },
  "recipe_id": "pg-unsloth-qwen3-6-35b-a3b-gguf-qwen3-6-35b-a3b-ud-iq3-xxs-gguf-iq3xxs-apple-m3-ultra-512gb-llama-cpp-dca79ae84b",
  "rows": [
    {
      "concurrency": 1,
      "context_tokens": 8256,
      "decode_tok_s": 87.14359630729011,
      "decode_tok_s_per_stream": null,
      "output_tokens": null,
      "peak_vram_gb": 18.08538818359375,
      "prefill_tok_s": null,
      "samples": 1,
      "status": "observed",
      "ttft_ms_p50": null
    },
    {
      "concurrency": 1,
      "context_tokens": 32832,
      "decode_tok_s": 78.57041136521,
      "decode_tok_s_per_stream": null,
      "output_tokens": null,
      "peak_vram_gb": 20.811691284179688,
      "prefill_tok_s": null,
      "samples": 1,
      "status": "observed",
      "ttft_ms_p50": 23323.119516097562
    },
    {
      "concurrency": 1,
      "context_tokens": 262080,
      "decode_tok_s": 37.69735152544689,
      "decode_tok_s_per_stream": null,
      "output_tokens": null,
      "peak_vram_gb": 20.811691284179688,
      "prefill_tok_s": null,
      "samples": 1,
      "status": "observed",
      "ttft_ms_p50": null
    }
  ],
  "schema_version": "local-ai-registry/v1",
  "source": {
    "commit": null,
    "paths": [
      "publication:pg-20260827T060320709Z",
      "run:019f8a23-1d69-7248-bdcf-121a0a452026"
    ],
    "repository": "https://local.ai"
  }
}
