{
  "accepted_at": null,
  "id": "qwen36-35b-ud-q4-k-m-rtx-h100-sxm-80gb-ollama-tp1-sweep",
  "measured_at": "2026-09-01T00:00:00Z",
  "metrics": {
    "concurrency": 1,
    "inference_engine_version": "0.33.2",
    "latest_point_at": "2026-09-01T00:00:00Z",
    "max_context_tokens": 32768,
    "peak_generation_tps": 1.944862631578947e+16,
    "peak_prompt_tps": 6.201486875e+17,
    "point_count": 1
  },
  "recipe_id": "qwen36-35b-ud-q4-k-m-rtx-h100-sxm-80gb-ollama-tp1",
  "rows": [
    {
      "concurrency": 1,
      "context_tokens": 32768,
      "decode_tok_s": 1.944862631578947e+16,
      "decode_tok_s_per_stream": 1.944862631578947e+16,
      "output_tokens": 190,
      "peak_vram_gb": null,
      "prefill_tok_s": 6.201486875e+17,
      "samples": 1,
      "status": "observed",
      "ttft_ms_p50": 18981.8
    }
  ],
  "schema_version": "local-ai-registry/v1",
  "source": {
    "commit": null,
    "kind": "validation-run",
    "paths": null,
    "repository": null,
    "url": "https://github.com/0xSero/local-ai-registry"
  }
}
