{
  "accepted_at": null,
  "id": "ornstein3-6-27b-mtp-nsc-ace-saber-q4-k-m-rtx-3090-24gb-llama-cpp-tp1-sweep",
  "measured_at": "2026-05-19T17:45:25.664Z",
  "metrics": {
    "concurrency": 256,
    "latest_point_at": "2026-05-19T17:45:25.664Z",
    "max_context_tokens": 262144,
    "peak_generation_tps": 32.88,
    "peak_prompt_tps": 98.94,
    "point_count": 1
  },
  "recipe_id": "ornstein3-6-27b-mtp-nsc-ace-saber-q4-k-m-rtx-3090-24gb-llama-cpp-tp1",
  "rows": [
    {
      "concurrency": 256,
      "context_tokens": 262144,
      "decode_tok_s": 32.88,
      "decode_tok_s_per_stream": null,
      "output_tokens": 0,
      "peak_vram_gb": 21.99,
      "prefill_tok_s": 98.94,
      "samples": 1,
      "status": "observed",
      "ttft_ms_p50": null
    }
  ],
  "schema_version": "local-ai-registry/v1",
  "source": {
    "commit": null,
    "kind": "leaderboard",
    "paths": [
      "/en/runs/cmpcxbhcw00fynw017wgjyvsp"
    ],
    "repository": "https://www.localmaxxing.com",
    "url": "https://www.localmaxxing.com/en/runs/cmpcxbhcw00fynw017wgjyvsp"
  }
}
