{
  "accepted_at": null,
  "id": "pg-019f7582-f1df-712d-b08e-1c004f8d096e-sweep",
  "measured_at": "2026-07-18T13:55:43.682Z",
  "metrics": {
    "base_memory_bytes": "37134480110",
    "base_memory_context_tokens": 192,
    "concurrency": 1,
    "decode32k_context_tokens": 32832,
    "decode32k_tps": 61.2044,
    "decode8k_context_tokens": 8256,
    "decode8k_tps": 71.3534,
    "decode_max_context_tokens": 65600,
    "decode_max_context_tps": 54.0909,
    "decode_mode": "non-mtp",
    "inference_engine_version": "0.31.3",
    "latest_point_at": "2026-07-18T13:55:43.682Z",
    "max_context_tokens": 65600,
    "max_prompt_tokens": 65536,
    "memory8k_bytes": "39294965790",
    "memory8k_context_tokens": 8256,
    "memory_max_context_bytes": "45355170082",
    "memory_max_context_tokens": 65600,
    "peak_generation_tps": 61.2044,
    "peak_memory_bytes": "45355170082",
    "peak_prompt_tps": 1318.4976,
    "point_count": 56,
    "ttft32k_cached_prompt_tokens": 28736,
    "ttft32k_context_tokens": 32768,
    "ttft32k_seconds": 24.85252912102381
  },
  "recipe_id": "pg-mlx-community-agents-a1-8bit-8bit-apple-m3-ultra-96gb-60c-mlx-ff5a376706",
  "rows": [
    {
      "concurrency": 1,
      "context_tokens": 8256,
      "decode_tok_s": 71.3534,
      "decode_tok_s_per_stream": 71.3534,
      "output_tokens": null,
      "peak_vram_gb": 36.59628870896995,
      "prefill_tok_s": null,
      "samples": 1,
      "status": "observed",
      "ttft_ms_p50": null
    },
    {
      "concurrency": 1,
      "context_tokens": 32832,
      "decode_tok_s": 61.2044,
      "decode_tok_s_per_stream": 61.2044,
      "output_tokens": null,
      "peak_vram_gb": 42.240293772891164,
      "prefill_tok_s": null,
      "samples": 1,
      "status": "observed",
      "ttft_ms_p50": null
    },
    {
      "concurrency": 1,
      "context_tokens": 65600,
      "decode_tok_s": 54.0909,
      "decode_tok_s_per_stream": 54.0909,
      "output_tokens": null,
      "peak_vram_gb": 42.240293772891164,
      "prefill_tok_s": null,
      "samples": 1,
      "status": "observed",
      "ttft_ms_p50": null
    },
    {
      "concurrency": 1,
      "context_tokens": 32768,
      "decode_tok_s": null,
      "decode_tok_s_per_stream": null,
      "output_tokens": null,
      "peak_vram_gb": null,
      "prefill_tok_s": null,
      "samples": 1,
      "status": "observed",
      "ttft_ms_p50": 24852.52912102381
    }
  ],
  "schema_version": "local-ai-registry/v1",
  "source": {
    "commit": null,
    "paths": [
      "publication:pg-20260827T060320709Z",
      "run:019f7582-f1df-712d-b08e-1c004f8d096e"
    ],
    "repository": "https://local.ai"
  }
}
