{
  "accepted_at": null,
  "id": "unsloth-qwen3-5-9b-gguf--q4-k-m-rtx-5060-ti-16gb-ollama-tp1-sweep",
  "measured_at": "2026-09-02T16:45:30Z",
  "metrics": {
    "concurrency": 1,
    "inference_engine_version": "0.33.2",
    "latest_point_at": "2026-09-02T16:45:30Z",
    "max_context_tokens": 32768,
    "peak_generation_tps": null,
    "peak_prompt_tps": null,
    "point_count": 1
  },
  "recipe_id": "unsloth-qwen3-5-9b-gguf--q4-k-m-rtx-5060-ti-16gb-ollama-tp1",
  "rows": [
    {
      "concurrency": 1,
      "context_tokens": 32768,
      "decode_tok_s": null,
      "decode_tok_s_per_stream": null,
      "output_tokens": 200,
      "peak_vram_gb": null,
      "prefill_tok_s": null,
      "samples": 1,
      "status": "observed",
      "ttft_ms_p50": null
    }
  ],
  "schema_version": "local-ai-registry/v1",
  "source": {
    "commit": null,
    "kind": "lane-experiment",
    "paths": [
      "docs/notes/lane-ollama-evidence-focus-blackwell.json"
    ],
    "repository": "https://github.com/0xSero/local-ai-registry"
  }
}
