{
  "accepted_at": null,
  "id": "qwen3-6-35b-a3b-nvfp4-rtx-pro-6000-blackwell-96gb-vllm-tp4-sweep",
  "measured_at": "2026-06-30T10:32:33.098Z",
  "metrics": {
    "concurrency": 1,
    "latest_point_at": "2026-06-30T10:32:33.098Z",
    "max_context_tokens": 2048,
    "peak_generation_tps": 325.9374054721711,
    "peak_prompt_tps": 17258.80239947657,
    "point_count": 1
  },
  "recipe_id": "qwen3-6-35b-a3b-nvfp4-rtx-pro-6000-blackwell-96gb-vllm-tp4",
  "rows": [
    {
      "concurrency": 1,
      "context_tokens": 2048,
      "decode_tok_s": 325.9374054721711,
      "decode_tok_s_per_stream": null,
      "output_tokens": 2048,
      "peak_vram_gb": null,
      "prefill_tok_s": 17258.80239947657,
      "samples": 1,
      "status": "observed",
      "ttft_ms_p50": 38.73724500226672
    }
  ],
  "schema_version": "local-ai-registry/v1",
  "source": {
    "commit": null,
    "kind": "leaderboard",
    "paths": [
      "/en/runs/cmr0icksp00g9ld01r2foa5ep"
    ],
    "repository": "https://www.localmaxxing.com",
    "url": "https://www.localmaxxing.com/en/runs/cmr0icksp00g9ld01r2foa5ep"
  }
}
