{
  "accepted_at": null,
  "id": "pg-01a03076-e820-7c71-a01b-9f36002e8da3-sweep",
  "measured_at": "2026-08-23T21:11:34.167Z",
  "metrics": {
    "base_memory_bytes": "6868303872",
    "base_memory_context_tokens": 192,
    "concurrency": 1,
    "decode32k_context_tokens": 32832,
    "decode32k_tps": 163.01247045398972,
    "decode8k_context_tokens": 8256,
    "decode8k_tps": 188.5863976167394,
    "decode_max_context_tokens": 127936,
    "decode_max_context_tps": 107.17018793297174,
    "decode_mode": "non-mtp",
    "inference_engine_version": "unknown",
    "latest_point_at": "2026-08-23T21:11:34.167Z",
    "max_context_tokens": 127936,
    "max_prompt_tokens": 127872,
    "memory8k_bytes": "6918963200",
    "memory8k_context_tokens": 8256,
    "memory_max_context_bytes": "7440596992",
    "memory_max_context_tokens": 127936,
    "peak_generation_tps": 163.01247045398972,
    "peak_memory_bytes": "7440596992",
    "peak_prompt_tps": 1855.5083934601023,
    "point_count": 112,
    "ttft32k_cached_prompt_tokens": 28668,
    "ttft32k_context_tokens": 32768,
    "ttft32k_seconds": 17.659850052682927
  },
  "recipe_id": "pg-lfm2-5-8b-a1b-q4km-unknown-apple-m4-max-36gb-llama-cpp-a2f61dc20a",
  "rows": [
    {
      "concurrency": 1,
      "context_tokens": 8256,
      "decode_tok_s": 188.5863976167394,
      "decode_tok_s_per_stream": null,
      "output_tokens": null,
      "peak_vram_gb": 6.44378662109375,
      "prefill_tok_s": null,
      "samples": 1,
      "status": "observed",
      "ttft_ms_p50": null
    },
    {
      "concurrency": 1,
      "context_tokens": 32832,
      "decode_tok_s": 163.01247045398972,
      "decode_tok_s_per_stream": null,
      "output_tokens": null,
      "peak_vram_gb": 6.929595947265625,
      "prefill_tok_s": null,
      "samples": 1,
      "status": "observed",
      "ttft_ms_p50": 17659.850052682927
    },
    {
      "concurrency": 1,
      "context_tokens": 127936,
      "decode_tok_s": 107.17018793297174,
      "decode_tok_s_per_stream": null,
      "output_tokens": null,
      "peak_vram_gb": 6.929595947265625,
      "prefill_tok_s": null,
      "samples": 1,
      "status": "observed",
      "ttft_ms_p50": null
    }
  ],
  "schema_version": "local-ai-registry/v1",
  "source": {
    "commit": null,
    "paths": [
      "publication:pg-20260827T060320709Z",
      "run:01a03076-e820-7c71-a01b-9f36002e8da3"
    ],
    "repository": "https://local.ai"
  }
}
