{
  "accepted_at": null,
  "id": "pg-019f86c6-3410-7fe5-885e-ee80279cdbfc-sweep",
  "measured_at": "2026-07-21T22:22:44.106Z",
  "metrics": {
    "base_memory_bytes": "49884927584",
    "base_memory_context_tokens": 192,
    "concurrency": 1,
    "decode32k_context_tokens": 32832,
    "decode32k_tps": 46.161524945976595,
    "decode8k_context_tokens": 8256,
    "decode8k_tps": 51.47533125179962,
    "decode_max_context_tokens": 262080,
    "decode_max_context_tps": 13.458771891270787,
    "decode_mode": "non-mtp",
    "inference_engine_version": "unknown",
    "latest_point_at": "2026-07-21T22:22:44.106Z",
    "max_context_tokens": 262080,
    "max_prompt_tokens": 262016,
    "memory8k_bytes": "51680941664",
    "memory8k_context_tokens": 8256,
    "memory_max_context_bytes": "108212622944",
    "memory_max_context_tokens": 262080,
    "peak_generation_tps": 43.16452631316268,
    "peak_memory_bytes": "108212622944",
    "peak_prompt_tps": 365.88082682635365,
    "point_count": 224,
    "ttft32k_cached_prompt_tokens": 28677,
    "ttft32k_context_tokens": 32768,
    "ttft32k_seconds": 74.96132151943291
  },
  "recipe_id": "pg-unsloth-mimo-v2-flash-gguf-ud-iq1-m-mimo-v2-flash-ud-iq1-m-e8b4758992d0-apple-m3-ultra-512gb-llama-cpp-b60ac8336d",
  "rows": [
    {
      "concurrency": 1,
      "context_tokens": 8256,
      "decode_tok_s": 51.47533125179962,
      "decode_tok_s_per_stream": null,
      "output_tokens": null,
      "peak_vram_gb": 48.13162764906883,
      "prefill_tok_s": null,
      "samples": 1,
      "status": "observed",
      "ttft_ms_p50": null
    },
    {
      "concurrency": 1,
      "context_tokens": 32832,
      "decode_tok_s": 46.161524945976595,
      "decode_tok_s_per_stream": null,
      "output_tokens": null,
      "peak_vram_gb": 100.78085860610008,
      "prefill_tok_s": null,
      "samples": 1,
      "status": "observed",
      "ttft_ms_p50": 74961.32151943291
    },
    {
      "concurrency": 1,
      "context_tokens": 262080,
      "decode_tok_s": 13.458771891270787,
      "decode_tok_s_per_stream": null,
      "output_tokens": null,
      "peak_vram_gb": 100.78085860610008,
      "prefill_tok_s": null,
      "samples": 1,
      "status": "observed",
      "ttft_ms_p50": null
    }
  ],
  "schema_version": "local-ai-registry/v1",
  "source": {
    "commit": null,
    "paths": [
      "publication:pg-20260827T060320709Z",
      "run:019f86c6-3410-7fe5-885e-ee80279cdbfc"
    ],
    "repository": "https://local.ai"
  }
}
