{
  "accepted_at": null,
  "id": "gemma-4-31b-ud-q4-k-xl-qat-apple-m5-max-128gb-llama-cpp-tp1-sweep",
  "measured_at": "2026-06-19T23:05:39.699Z",
  "metrics": {
    "concurrency": 1,
    "latest_point_at": "2026-06-19T23:05:39.699Z",
    "max_context_tokens": 2048,
    "peak_generation_tps": 26.32419,
    "peak_prompt_tps": 576.322611,
    "point_count": 1
  },
  "recipe_id": "gemma-4-31b-ud-q4-k-xl-qat-apple-m5-max-128gb-llama-cpp-tp1",
  "rows": [
    {
      "concurrency": 1,
      "context_tokens": 2048,
      "decode_tok_s": 26.32419,
      "decode_tok_s_per_stream": 26.32419,
      "output_tokens": 128,
      "peak_vram_gb": null,
      "prefill_tok_s": 576.322611,
      "samples": 1,
      "status": "observed",
      "ttft_ms_p50": 888
    }
  ],
  "schema_version": "local-ai-registry/v1",
  "source": {
    "commit": null,
    "kind": "leaderboard",
    "paths": [
      "/en/runs/cmqljepo301b7nv01emylv5si"
    ],
    "repository": "https://www.localmaxxing.com",
    "url": "https://www.localmaxxing.com/en/runs/cmqljepo301b7nv01emylv5si"
  }
}
