{
  "accepted_at": null,
  "facts": {
    "source": {
      "note": "Numbers reported by the poster, kept with their own wording in the row labels.",
      "provenance": {
        "captured_at": "2026-09-19T05:35:00Z",
        "sources": [
          {
            "captured_at": "2026-09-19T05:35:00Z",
            "kind": "discord-report",
            "publisher": "RTX6kPRO Bot",
            "url": "https://discord.com/channels/1466898002793857221/1481304034198421515/1547969741967204453"
          }
        ]
      },
      "state": "known"
    }
  },
  "id": "discord-sweep-1547969741967204453",
  "measured_at": "2026-09-11T13:59:06.372000+00:00",
  "metrics": {
    "inference_engine_version": "localinferencelab/vllm:jovian-judgement-community-20260911-r35"
  },
  "provenance": {
    "captured_at": "2026-09-19T05:35:00Z",
    "sources": [
      {
        "captured_at": "2026-09-19T05:35:00Z",
        "kind": "discord-report",
        "publisher": "RTX6kPRO Bot",
        "url": "https://discord.com/channels/1466898002793857221/1481304034198421515/1547969741967204453"
      }
    ]
  },
  "recipe_id": "discord-lil-glm53-flash-nvfp4-46aaae8a8203-rtx-pro-6000-blackwell-96gb-tp0",
  "rows": [
    {
      "concurrency": null,
      "context_tokens": null,
      "decode_tok_s": 16694.0,
      "label": "s/ds4-jovian-community-r29.md GLM-only R34 → R35-component control: 32K prefill 16,872 →",
      "output_tokens": null,
      "peak_vram_gb": null,
      "prefill_tok_s": null,
      "samples": null,
      "status": "reported",
      "ttft_ms_p50": null,
      "verifier_steps_per_s": null
    }
  ],
  "schema_version": "local-ai-registry/v1",
  "source": {
    "captured_at": "2026-09-19T05:35:00Z",
    "kind": "discord-report",
    "publisher": "RTX6kPRO Bot",
    "url": "https://discord.com/channels/1466898002793857221/1481304034198421515/1547969741967204453"
  }
}
