{
  "accepted_at": null,
  "id": "minimax-m2-7-autoround-int4-w4a16-intel-arc-pro-b70-32gb-vllm-tp4-sweep",
  "measured_at": "2026-05-21",
  "metrics": {
    "concurrency": 1,
    "latest_point_at": "2026-05-21",
    "max_context_tokens": 2048,
    "peak_generation_tps": 93.4436231838881,
    "peak_prompt_tps": null,
    "point_count": 1
  },
  "recipe_id": "minimax-m2-7-autoround-int4-w4a16-intel-arc-pro-b70-32gb-vllm-tp4",
  "rows": [
    {
      "concurrency": 1,
      "context_tokens": 2048,
      "decode_tok_s": 93.4436231838881,
      "decode_tok_s_per_stream": null,
      "output_tokens": 1536,
      "peak_vram_gb": null,
      "prefill_tok_s": null,
      "samples": 1,
      "status": "historical",
      "ttft_ms_p50": null
    }
  ],
  "schema_version": "local-ai-registry/v1",
  "source": {
    "commit": null,
    "paths": null,
    "repository": "https://www.localmaxxing.com"
  }
}
