{
  "accepted_at": null,
  "id": "pg-019f3295-e23f-7045-a473-4ea475cd98a6-sweep",
  "measured_at": "2026-07-05T14:01:51.419Z",
  "metrics": {
    "base_memory_bytes": "69242544356",
    "base_memory_context_tokens": 192,
    "concurrency": 1,
    "decode32k_context_tokens": 32832,
    "decode32k_tps": 47.6476,
    "decode8k_context_tokens": 8256,
    "decode8k_tps": 50.8782,
    "decode_max_context_tokens": 258111,
    "decode_max_context_tps": 31.9566,
    "decode_mode": "non-mtp",
    "inference_engine_version": "unknown",
    "latest_point_at": "2026-07-05T14:01:51.419Z",
    "max_context_tokens": 258111,
    "max_prompt_tokens": 258047,
    "memory8k_bytes": "77217455288",
    "memory8k_context_tokens": 8256,
    "memory_max_context_bytes": "81244019960",
    "memory_max_context_tokens": 258111,
    "peak_generation_tps": 49.9349,
    "peak_memory_bytes": "81244019960",
    "peak_prompt_tps": 38.5922,
    "point_count": 223,
    "ttft32k_cached_prompt_tokens": 28736,
    "ttft32k_context_tokens": 32768,
    "ttft32k_seconds": 52.041982353562446
  },
  "recipe_id": "pg-mlx-community-nvidia-nemotron-3-super-120b-a12b-4bit-4bit-apple-m3-ultra-96gb-80c-mlx-5e2708610b",
  "rows": [
    {
      "concurrency": 1,
      "context_tokens": 8256,
      "decode_tok_s": 50.8782,
      "decode_tok_s_per_stream": 50.8782,
      "output_tokens": null,
      "peak_vram_gb": 71.91435926407576,
      "prefill_tok_s": null,
      "samples": 1,
      "status": "observed",
      "ttft_ms_p50": null
    },
    {
      "concurrency": 1,
      "context_tokens": 32832,
      "decode_tok_s": 47.6476,
      "decode_tok_s_per_stream": 47.6476,
      "output_tokens": null,
      "peak_vram_gb": 75.66438984125853,
      "prefill_tok_s": null,
      "samples": 1,
      "status": "observed",
      "ttft_ms_p50": null
    },
    {
      "concurrency": 1,
      "context_tokens": 258111,
      "decode_tok_s": 31.9566,
      "decode_tok_s_per_stream": 31.9566,
      "output_tokens": null,
      "peak_vram_gb": 75.66438984125853,
      "prefill_tok_s": null,
      "samples": 1,
      "status": "observed",
      "ttft_ms_p50": null
    },
    {
      "concurrency": 1,
      "context_tokens": 32768,
      "decode_tok_s": null,
      "decode_tok_s_per_stream": null,
      "output_tokens": null,
      "peak_vram_gb": null,
      "prefill_tok_s": null,
      "samples": 1,
      "status": "observed",
      "ttft_ms_p50": 52041.982353562445
    }
  ],
  "schema_version": "local-ai-registry/v1",
  "source": {
    "commit": null,
    "paths": [
      "publication:pg-20260827T060320709Z",
      "run:019f3295-e23f-7045-a473-4ea475cd98a6"
    ],
    "repository": "https://local.ai"
  }
}
