{
  "accepted_at": null,
  "id": "diffusiongemma-26b-a4b-bf16-rtx-pro-6000-blackwell-96gb-vllm-tp1-sweep",
  "measured_at": "2026-07-02",
  "metrics": {
    "concurrency": null,
    "inference_engine_version": "0.1.dev1+ga275a28e0",
    "latest_point_at": "2026-07-02",
    "max_context_tokens": 8192,
    "peak_generation_tps": 528.7,
    "peak_prompt_tps": null,
    "point_count": 1
  },
  "recipe_id": "diffusiongemma-26b-a4b-bf16-rtx-pro-6000-blackwell-96gb-vllm-tp1",
  "rows": [
    {
      "concurrency": null,
      "context_tokens": 8192,
      "decode_tok_s": 528.7,
      "decode_tok_s_per_stream": null,
      "output_tokens": 256,
      "peak_vram_gb": null,
      "prefill_tok_s": null,
      "samples": 1,
      "status": "historical",
      "ttft_ms_p50": null
    }
  ],
  "schema_version": "local-ai-registry/v1",
  "source": {
    "commit": null,
    "paths": [
      "/en/runs/cmr37xws306stpi01f5g70cvn"
    ],
    "repository": "https://www.localmaxxing.com"
  }
}
